[
  {
    "id": "ui.system.app-shell",
    "layer": "ui",
    "title": "App shell",
    "kind": "shell_system",
    "owner": "dashboard",
    "source_of_truth": "app-shell component",
    "status_tag": "live",
    "repo_source": ["projects/dashboard/src/components/app-shell.tsx"],
    "runtime_source": ["Workshop dashboard shell"],
    "depends_on": ["api.family.dashboard.overview"],
    "backed_by": ["desktop sidebar", "mobile sheet nav", "top header"],
    "entrypoints": ["all dashboard routes"],
    "notes": ["Global navigation and shell framing."]
  },
  {
    "id": "ui.system.command-palette",
    "layer": "ui",
    "title": "Command palette",
    "kind": "shell_system",
    "owner": "dashboard",
    "source_of_truth": "command-palette component",
    "status_tag": "live",
    "repo_source": ["projects/dashboard/src/components/command-palette.tsx"],
    "runtime_source": ["Dashboard keyboard shortcut Ctrl/Cmd+K"],
    "depends_on": ["ui.system.app-shell", "api.family.dashboard.overview"],
    "backed_by": ["route families", "overview alerts", "project list", "external tools"],
    "entrypoints": ["Ctrl+K", "Cmd+K"],
    "notes": ["Global route and action launcher."]
  },
  {
    "id": "ui.system.url-state",
    "layer": "ui",
    "title": "URL state helper",
    "kind": "cross_cutting_state",
    "owner": "dashboard",
    "source_of_truth": "useUrlState hook",
    "status_tag": "live",
    "repo_source": ["projects/dashboard/src/lib/url-state.ts"],
    "runtime_source": ["client-side query string state"],
    "depends_on": ["ui.system.app-shell"],
    "backed_by": ["search params", "router.replace"],
    "entrypoints": ["query string"],
    "notes": ["Shareable filter and selection state."]
  },
  {
    "id": "ui.system.local-state",
    "layer": "ui",
    "title": "Persistent browser state",
    "kind": "cross_cutting_state",
    "owner": "dashboard",
    "source_of_truth": "state helper",
    "status_tag": "live",
    "repo_source": ["projects/dashboard/src/lib/state.ts"],
    "runtime_source": ["browser localStorage"],
    "depends_on": ["ui.system.app-shell"],
    "backed_by": ["uiPreferences", "directChatSessions", "agentThreads", "promptHistory"],
    "entrypoints": ["localStorage"],
    "notes": ["Non-shareable operator state."]
  },
  {
    "id": "ui.system.lens",
    "layer": "ui",
    "title": "Lens system",
    "kind": "cross_cutting_state",
    "owner": "dashboard",
    "source_of_truth": "lens config and provider",
    "status_tag": "implemented_not_live",
    "repo_source": ["projects/dashboard/src/lib/lens.ts", "projects/dashboard/src/hooks/use-lens.tsx", "projects/dashboard/src/components/lens-switcher.tsx"],
    "runtime_source": ["unmounted provider"],
    "depends_on": ["ui.system.app-shell"],
    "backed_by": ["lens config", "lens switcher"],
    "entrypoints": ["?lens=default|system|media|creative|eoq"],
    "notes": ["Defined in code, but provider is not mounted in the root shell."]
  },
  {
    "id": "ui.system.pwa",
    "layer": "ui",
    "title": "PWA and push surface",
    "kind": "cross_cutting_state",
    "owner": "dashboard",
    "source_of_truth": "service-worker and push components",
    "status_tag": "live",
    "repo_source": ["projects/dashboard/src/components/register-sw.tsx", "projects/dashboard/src/components/push-manager.tsx", "projects/dashboard/src/app/offline/page.tsx"],
    "runtime_source": ["browser service worker and push manager"],
    "depends_on": ["api.family.dashboard.support"],
    "backed_by": ["service worker", "push subscribe"],
    "entrypoints": ["/offline", "/api/push/subscribe"],
    "notes": ["Offline fallback and notification opt-in."]
  },
  {
    "id": "ui.system.terminal-bridge",
    "layer": "ui",
    "title": "Terminal bridge",
    "kind": "cross_cutting_state",
    "owner": "dashboard",
    "source_of_truth": "terminal-view component",
    "status_tag": "live",
    "repo_source": ["projects/dashboard/src/components/terminal-view.tsx", "projects/dashboard/src/features/terminal/terminal-console.tsx"],
    "runtime_source": ["ws-pty bridge on Workshop"],
    "depends_on": ["topology.node.workshop"],
    "backed_by": ["xterm.js", "WebSocket PTY bridge"],
    "entrypoints": ["/terminal", "ws://<host>:3100/ws?node=<id>"],
    "notes": ["Escape hatch for direct shell access."]
  },
  {
    "id": "ui.route.command-center",
    "layer": "ui",
    "title": "Command Center route",
    "kind": "route",
    "owner": "dashboard",
    "source_of_truth": "route page and feature module",
    "status_tag": "live",
    "repo_source": ["projects/dashboard/src/app/page.tsx", "projects/dashboard/src/features/overview/command-center.tsx"],
    "runtime_source": ["Dashboard / route"],
    "depends_on": ["ui.system.app-shell", "api.family.dashboard.overview"],
    "backed_by": ["CommandCenter", "OverviewSnapshot"],
    "entrypoints": ["/"],
    "notes": ["Launch surface for posture, alerts, projects, and recent context."]
  },
  {
    "id": "ui.route.services",
    "layer": "ui",
    "title": "Services route",
    "kind": "route",
    "owner": "dashboard",
    "source_of_truth": "route page and feature module",
    "status_tag": "live",
    "repo_source": ["projects/dashboard/src/app/services/page.tsx", "projects/dashboard/src/features/services/services-console.tsx"],
    "runtime_source": ["Dashboard /services route"],
    "depends_on": ["ui.system.url-state", "api.family.dashboard.services"],
    "backed_by": ["ServicesConsole", "ServicesSnapshot"],
    "entrypoints": ["/services"],
    "notes": ["URL state: search, status, node, category, sort, service, window."]
  },
  {
    "id": "ui.route.gpu",
    "layer": "ui",
    "title": "GPU route",
    "kind": "route",
    "owner": "dashboard",
    "source_of_truth": "route page and feature module",
    "status_tag": "live",
    "repo_source": ["projects/dashboard/src/app/gpu/page.tsx", "projects/dashboard/src/features/gpu/gpu-console.tsx"],
    "runtime_source": ["Dashboard /gpu route"],
    "depends_on": ["ui.system.url-state", "api.family.dashboard.gpu"],
    "backed_by": ["GpuConsole", "GpuSnapshotResponse", "GpuHistoryResponse"],
    "entrypoints": ["/gpu"],
    "notes": ["URL state: window, highlight, compare."]
  },
  {
    "id": "ui.route.workplanner",
    "layer": "ui",
    "title": "Work Planner route",
    "kind": "route",
    "owner": "dashboard",
    "source_of_truth": "route page and feature module",
    "status_tag": "live",
    "repo_source": ["projects/dashboard/src/app/workplanner/page.tsx", "projects/dashboard/src/features/workforce/work-planner-console.tsx"],
    "runtime_source": ["Dashboard /workplanner route"],
    "depends_on": ["ui.system.url-state", "api.family.dashboard.workforce", "api.family.dashboard.research-scheduling"],
    "backed_by": ["WorkPlannerConsole", "WorkforceSnapshot"],
    "entrypoints": ["/workplanner"],
    "notes": ["URL state: search, project, status. Also surfaces research jobs and scheduler posture."]
  },
  {
    "id": "ui.route.chat",
    "layer": "ui",
    "title": "Direct Chat route",
    "kind": "route",
    "owner": "dashboard",
    "source_of_truth": "route page and feature module",
    "status_tag": "live",
    "repo_source": ["projects/dashboard/src/app/chat/page.tsx", "projects/dashboard/src/features/chat/direct-chat-console.tsx"],
    "runtime_source": ["Dashboard /chat route"],
    "depends_on": ["ui.system.url-state", "ui.system.local-state", "api.family.dashboard.chat", "api.family.dashboard.routing-context"],
    "backed_by": ["DirectChatConsole", "ModelsSnapshot"],
    "entrypoints": ["/chat"],
    "notes": ["URL state: session, model. Local state: sessions, prompts, preferences. Includes routing and context preview before dispatch."]
  },
  {
    "id": "ui.route.agents",
    "layer": "ui",
    "title": "Agent Console route",
    "kind": "route",
    "owner": "dashboard",
    "source_of_truth": "route page and feature module",
    "status_tag": "live",
    "repo_source": ["projects/dashboard/src/app/agents/page.tsx", "projects/dashboard/src/features/agents/agent-console.tsx"],
    "runtime_source": ["Dashboard /agents route"],
    "depends_on": ["ui.system.url-state", "ui.system.local-state", "api.family.dashboard.chat", "api.family.dashboard.models-agents", "api.family.dashboard.subscriptions", "api.family.dashboard.routing-context", "api.family.dashboard.governor", "api.family.dashboard.model-governance"],
    "backed_by": ["AgentConsole", "AgentsSnapshot"],
    "entrypoints": ["/agents"],
    "notes": ["URL state: agent, thread. Local state: agent threads and preferences. Includes crew, subscription, and routing posture panels."]
  },
  {
    "id": "ui.route.tasks",
    "layer": "ui",
    "title": "Tasks route",
    "kind": "route",
    "owner": "dashboard",
    "source_of_truth": "route page and feature module",
    "status_tag": "live",
    "repo_source": ["projects/dashboard/src/app/tasks/page.tsx", "projects/dashboard/src/features/workforce/tasks-console.tsx"],
    "runtime_source": ["Dashboard /tasks route"],
    "depends_on": ["ui.system.url-state", "api.family.dashboard.workforce", "api.family.dashboard.subscriptions"],
    "backed_by": ["TasksConsole", "WorkforceSnapshot"],
    "entrypoints": ["/tasks"],
    "notes": ["URL state: search, status, agent. Includes execution lease visibility before queueing larger work."]
  },
  {
    "id": "ui.route.goals",
    "layer": "ui",
    "title": "Goals route",
    "kind": "route",
    "owner": "dashboard",
    "source_of_truth": "route page and feature module",
    "status_tag": "live",
    "repo_source": ["projects/dashboard/src/app/goals/page.tsx", "projects/dashboard/src/features/workforce/goals-console.tsx"],
    "runtime_source": ["Dashboard /goals route"],
    "depends_on": ["api.family.dashboard.workforce"],
    "backed_by": ["GoalsConsole", "WorkforceSnapshot"],
    "entrypoints": ["/goals"],
    "notes": ["Local form state for goal creation; no shareable query model today."]
  },
  {